"时间","热点信号","对创作者的意义","来源链接","可信度","内容机会"
"2026-06-26","OpenAI 发布 GPT-5.6-SOL 预览","最强模型继续分层开放，适合讲前沿模型为什么越来越像限量供给","https://openai.com/index/previewing-gpt-5-6-sol/","高","模型发布节奏、产品分层、AI 使用门槛"
"2026-06-27","Anthropic Fable 5 或将恢复、Mythos 5 管制出现松动","监管与安全审查正在直接改变模型发布时间表，适合讲发布权而不只是模型能力","https://www.axios.com/2026/06/27/anthropic-fable-5-return-soon ; https://www.businessinsider.com/anthropic-mythos-5-us-restrictions-fable-5-openai-gpt-2026-6","中（待验证）","监管叙事、前沿模型慢发布、供给差异"
"2026-06-25","The Shift to Agentic AI: Evidence from Codex 论文发布","Agent 终于有了真实使用数据，适合讲 AI 代做任务为什么开始进入组织工作流","https://arxiv.org/abs/2606.26959","高","Agent 落地、工作流升级、效率焦虑"
"2026-06-25","Adobe 宣布收购 Topaz Labs","本地 AI 修图、超分辨率、视频增强能力会进一步并入主流创作套件","https://news.adobe.com/news/2026/06/adobe-to-acquire-topaz-labs","高","修图/视频工作流、平台整合、本地 AI"
"2026-06-24","Google 被曝将 Gemini 3.5 Pro 延期至 7 月","说明 Agent 模型竞争正在从能不能做转向成本与稳定性是否可持续","https://www.businessinsider.com/google-3-5-pro-july-release-tokens-ai-agents-model-2026-6","中（待验证）","Agent 成本、模型跳票、平台竞争"
